Continental Group,"Male Effect (β, P-Value)","Female Effect (β, P-Value)",Interpretation
South Asia,None,None,No significant effects observed for either gender.
Europe & Central Asia,Media Campaign: -0.21 (P = 0.091),Advertisement Ban: +0.70 (P = 0.035),Borderline decrease in male tobacco use from media campaigns. Counterintuitive increase in female tobacco use from ad bans.
Middle East & North Africa,Advertisement Ban: +1.41 (P = 0.004),None,Counterintuitive increase in male tobacco use from ad bans.
Americas,None,"Cessation Support: +0.51 (P = 0.049), Risk Warning: +0.32 (P = 0.011)",Unexpected increase in female tobacco use from cessation support and risk warnings.
East Asia & Pacific,Risk Warning: -1.11 (P = 0.007),Risk Warning: -0.88 (P = 0.049),Risk warnings reduce tobacco use for both genders.
Sub-Saharan Africa,None,"Advertisement Ban: +0.72 (P = 0.041), Exposure Protect: -0.62 (P = 0.086)",Counterintuitive increase in female tobacco use from ad bans. Borderline decrease from exposure protection.
